{
  "$schema": "cv-schema-enhanced.json",
  "metadata": {
    "version": "2.0",
    "lastUpdated": "2025-11-07",
    "totalSections": 32,
    "embeddingModel": "Xenova/distilbert-base-uncased",
    "embeddingDimensions": 768
  },
  "sections": {
    "core": {
      "main_profile": {
        "id": "main_profile",
        "keywords": ["Serhii Hrudakov", "Lead Frontend Developer", "software engineer", "10+ years", "computer science", "frontend", "fullstack", "team lead", "collaborative learning", "challenging development"],
        "embeddingSourceText": "Serhii Hrudakov Lead Frontend Developer result-driven software engineer computer science degree 10+ years experience commercial projects TypeScript React Node.js team leadership collaborative learning environment challenging development tasks Amsterdam Netherlands",
        "embeddings": null,
        "responses": {
          "hr": "Serhii is a Lead Frontend Developer with 10+ years of experience and a computer science degree. He's result-driven, seeks collaborative learning environments, and excels at challenging development tasks.",
          "developer": "I'm Serhii, a Lead Frontend Developer with 10+ years in commercial projects. I have a computer science background and love working in collaborative teams on challenging technical problems.",
          "friend": "Hey! I'm Serhii, been coding for over 10 years now and absolutely love it! I'm all about learning together and tackling those tricky development challenges that make you think üöÄ"
        },
        "details": {
          "name": "Serhii Hrudakov",
          "title": "Lead Frontend Developer",
          "experience_years": "10+",
          "degree": "Master of Computer Science and Engineering at Institute of Entrepreneurship and Advanced Technologies under Lviv Polytechnic University 2004-2009",
          "summary": "A result-driven software engineer with a computer science degree and 10+ years of experience in different commercial projects. Interested in finding a team with a collaborative learning environment and opportunities to solve challenging development tasks."
        },
        "relatedSections": ["frontend_stack", "leadership_style", "engineering_passion"],
        "priority": 1,
        "confidence": 1.0
      },
      "contact_info": {
        "id": "contact_info",
        "keywords": ["contact", "email", "linkedin", "phone", "amsterdam", "netherlands", "hrudakovserhii", "serhii-hrudakov"],
        "embeddingSourceText": "Contact Serhii Hrudakov email hrudakovserhii@gmail.com LinkedIn serhii-hrudakov phone +31614848082 Amsterdam Netherlands mobile contact information",
        "embeddings": null,
        "responses": {
          "hr": "You can reach Serhii at hrudakovserhii@gmail.com, connect on LinkedIn at serhii-hrudakov, or call +31614848082. He's based in Amsterdam, Netherlands.",
          "developer": "Feel free to reach out! Email me at hrudakovserhii@gmail.com or connect on LinkedIn (serhii-hrudakov). I'm based in Amsterdam if you want to chat about tech.",
          "friend": "Want to get in touch? Drop me an email at hrudakovserhii@gmail.com or find me on LinkedIn as serhii-hrudakov. I'm in Amsterdam, always up for a good tech chat! ‚òï"
        },
        "details": {
          "email": "hrudakovserhii@gmail.com",
          "linkedin": "serhii-hrudakov",
          "phone": "+31614848082",
          "location": "Amsterdam, Netherlands"
        },
        "relatedSections": [],
        "priority": 2,
        "confidence": 1.0
      }
    },
    "experience": {
      "hexaware_chatagent": {
        "id": "hexaware_chatagent",
        "keywords": ["ChatAgent", "Hexaware", "AI", "fullstack", "Senior Plus FullStack Engineer", "LLM", "MCP server", "WebSocket", "React", "Python", "AgGrid", "LangChain"],
        "embeddingSourceText": "ChatAgent project Hexaware Senior Plus FullStack Engineer AI powered tools MCP server WebSocket API React AgGrid Python TypeScript LangChain KeyClock GitLab deployment containerisation fully-customisable system client configuration",
        "embeddings": null,
        "responses": {
          "hr": "Led the ChatAgent project at Hexaware as Senior Plus FullStack Engineer, developing AI-powered tools with MCP servers. Managed full-stack development, WebSocket communication, and GitLab deployment pipelines.",
          "developer": "Working on ChatAgent - a fully customizable AI system using React, Python, and LangChain. Built WebSocket APIs, integrated MCP servers, and handled the full deployment pipeline with containerization.",
          "friend": "Currently working on this super cool AI project called ChatAgent! It's like building the future - AI agents that can read user info and help with different tools. The tech stack is amazing! ü§ñ"
        },
        "details": {
          "company": "Hexaware",
          "position": "Senior Plus FullStack Engineer",
          "period": "Jun 2025 - current",
          "project_name": "ChatAgent",
          "description": "Development of a fully-customisable system composed by client configuration and intended to integrate AI powered tools on different levels. Agents could read user information and provide assistance using MCP server and tools.",
          "achievements": [
            "Led development of FE application in collaboration with UX/UI designer",
            "Configured client-server communication channel using WebSocket API",
            "Designed and implemented data format and LLM prompt response to render different chart types",
            "Configured GitLab deployment pipeline and containerisation flow for QA process"
          ],
          "technologies": ["CRA", "React", "AgGrid", "HeadlessUI", "React Testing Library", "Jest", "TypeScript", "Python", "Node.js", "Redis", "LangChain", "KeyClock", "WebSocket API"]
        },
        "relatedSections": ["backend_stack", "ai_tools", "problem_solving"],
        "priority": 1,
        "confidence": 1.0
      },
      "hexaware_bonfire": {
        "id": "hexaware_bonfire",
        "keywords": ["Bonfire", "Hexaware", "Frontend Team Lead", "dating app", "NX monorepo", "Jest", "Playwright", "Scrum", "management", "TypeScript", "React", "SonarCloud"],
        "embeddingSourceText": "Bonfire dating app Hexaware Frontend Team Lead 60% coding 40% management NX monorepo TypeScript React Jest Playwright SonarCloud Scrum team management brand configuration UI library components",
        "embeddings": null,
        "responses": {
          "hr": "Led the Bonfire dating app project as Frontend Team Lead (60% coding/40% management). Built NX monorepo architecture, implemented comprehensive testing with Jest/Playwright, and managed team using Scrum methodology.",
          "developer": "Built a configurable dating app platform using NX monorepo with TypeScript and React. Set up comprehensive testing pipeline with Jest/Playwright, integrated SonarCloud, and managed the team processes.",
          "friend": "Led this really interesting dating app project! The cool part was building it as a configurable platform - each brand could customize their own version. Plus I got to balance coding with team leadership! üíï"
        },
        "details": {
          "company": "Hexaware",
          "position": "Frontend Team Lead",
          "period": "Aug 2024 - May 2025",
          "management_split": "60% coding / 40% management",
          "project_description": "Dating App platform with target to specific audience group. A Web app was built to be configured per brand and use core flow from a matching engine.",
          "achievements": [
            "Configured app monorepo using NX where each app represented a module",
            "Build pre-configuration for unit (Jest) and e2e (Playwright) tests coverage",
            "Implemented pre-commit hooks to maintain feedback loop between QA and Engineering team",
            "Implemented custom event based system using Axios interceptors",
            "Assisted team members during development, MR review and performed ceremonies to follow Scrum framework"
          ],
          "technologies": ["TypeScript", "React", "ReactRouter v7", "Axios", "Zod", "RTL", "Playwright", "Gitlab DevOps", "RestAPI", "Scrum"]
        },
        "relatedSections": ["frontend_stack", "testing_tools", "leadership_style"],
        "priority": 1,
        "confidence": 1.0
      },
      "hexaware_notification": {
        "id": "hexaware_notification",
        "keywords": ["Notification System", "Hexaware", "Frontend Team Lead", "safety regulations", "AI solutions", "React", "Node.js", "Flutter", "Azure DevOps", "6000 people"],
        "embeddingSourceText": "Notification System Hexaware Frontend Team Lead 70% coding 30% management safety regulations monitoring AI solutions React Node.js Flutter Azure DevOps national service provider 6000 employees",
        "embeddings": null,
        "responses": {
          "hr": "Led the Notification System project as Frontend Team Lead (70% coding/30% management) for a national service provider with 6000+ employees. Built safety regulation system using React, Node.js, and AI solutions with Azure DevOps.",
          "developer": "Built a comprehensive safety notification system for a large organization. Assembled and led the FE team, worked with React/Node.js stack, integrated AI helper solutions, and managed Azure DevOps pipelines.",
          "friend": "This was a really impactful project - helping 6000+ people stay safe at work! I got to build the team from scratch and create a system that actually makes a difference in people's daily safety. üõ°Ô∏è"
        },
        "details": {
          "company": "Hexaware",
          "position": "Frontend Team Lead",
          "period": "Jun 2023 - Jun 2024",
          "management_split": "70% coding / 30% management",